{
  "$schema": "../../../schemas/serveros.app.schema.json",
  "schemaVersion": 1,
  "id": "vault",
  "name": "Vault",
  "version": "1.0.0",
  "description": "A friendly server file cabinet for links, decisions, docs and checklists.",
  "icon": "📁",
  "category": "Knowledge",
  "entry": "index.ts",
  "serveros": {
    "minVersion": "0.1.5"
  },
  "publisher": {
    "name": "ServerOS Contributors"
  },
  "permissions": ["storage:read", "storage:write", "ui:reply", "logs:write"],
  "dependencies": [],
  "commands": ["vault"],
  "resources": {
    "storage": {
      "maxBytes": 10485760
    }
  },
  "license": "MIT",
  "releaseChannel": "stable"
}
